17,33,高端微流控芯片的设计制造及应用,"医疗器械,半导体/芯片,电子信息/电子设备",成长期,500-1000万,"广东,佛山","公司是一家致力于国际前沿的高性能芯片的技术研发及应用，可直接应用在生物医疗、石油工业、食品药品检验、新材料开发等多个领域。项目技术具有很高的创新性，主要体现在微流控设计体系的建立以及微流道表面微纳结构设计制造及表面改性新技术。
公司在2018年研发出基于微流控技术的农残快速检测仪（GB/T5999-2003)，将创新技术带入食品安全中。农残快检市场，全国仪器采购投入2个亿左右，市场相当广阔。我们的农残检测仪作为一种新技术，跟传统技术比，我们的农残检测仪全智能化操作，减少人力成本；试剂消耗降低90%，节省成本的同时，更降低试剂对环境的污染，更环保；互联网及大数据分析管理后台，为政府食品安全管理、决策提供科学依据。三大优势，让我们的农残快检仪能有效代替传统检测仪器，并能开拓更广泛的农残检测环境，将农残检测更深入到田间地头，食堂餐桌等。
公司同步开发了基于微流控技术的细胞计数仪，目前应用到牛奶安全检测中；后续会将细胞计数仪往生物医学方面进行发展应用，以国产代替进口，无论从价格还是服务上，都会产生更广阔的市场前景。
本次融资资金主要投入到仪器的生产以及芯片生产，尽快投放市场，产生经济效益。","[[""成正东    技术总监\n博士生导师，哈佛大学博士后。 TAMU教授，珠江学者，百人计划教授，1999年博士毕业于美国普林斯顿大学，目前担任广东省功能软凝聚态物质重点实验室主任。公司团队带头人,负责微流控芯片设计与研发。"", ""技术总监\n博士生导师，哈佛大学博士后。 TAMU教授，珠江学者，百人计划教授，1999年博士毕业于美国普林斯顿大学，目前担任广东省功能软凝聚态物质重点实验室主任。公司团队带头人,负责微流控芯片设计与研发。"", ""博士生导师，哈佛大学博士后。 TAMU教授，珠江学者，百人计划教授，1999年博士毕业于美国普林斯顿大学，目前担任广东省功能软凝聚态物质重点实验室主任。公司团队带头人,负责微流控芯片设计与研发。""]]",,"佛山市铬维科技有限公司2014年8月成立于佛山市南海高新区。自成立以来，铬维始终坚持技术标准国际化、技术推广全球化，致力于高端微流控芯片设计、制造与应用。
“功以才成，业由才广”，公司团队带头人一直活跃在微流控前沿领域，带领国际化人才团队，是微流控技术应用坚定的推行者。2018年，公司成立广州研发中心，“科技创新是科学发展的前提，人才是创新的核心要素”铬维充分运用了技术与人才的优势，获取专利60余项，全方位建立微流控技术与应用市场间的渠道，推动技术成果产业化。
铬维科技以开放融合的态度，兼容并蓄，与一大批国内外顶级科研机构建立良好的合作关系，共建互通的技术渠道。",佛山市铬维科技有限公司,914406053148648643,谭蓉,2014-08-25,1000万元,,互递名片后可见,互递名片后可见,广东股权交易中心广东金融高新区分公司,https://www.chinahtz.com/sizeScinspark/detail.do?id=135,https://www.chinahtz.com/fileUpload/2019-3/2c80f53e-5907-44cb-bdc3-5469d2677718.pdf
18,35,高性能光子集成芯片及器件的产业化,"新材料,半导体/芯片",成长期,1000-3000万,"陕西,西安",基于传统的分立器件、手工封装的方式所制作得光器件和系统在成本、速率、带宽、功耗等诸多方面已难以满足日益增长的海量数据传输和处理的需求，光子集成技术在这种背景条件下得以快速发展，成为继摩尔定律失效后在世界半导体领域的战略必争之地，从一般“科技战略”上升为“国家发展战略”，被誉为信息时代的巨大变革。作为国内光子集成领域的开拓者，西安奇芯光电科技有限公司凝聚了国内外顶尖的光通信和光子集成领域的人才，凭借在光通信研发和制造领域多年的经验，掌握全球唯一兼具高折射率差、超低损耗、微小尺寸、多层回路的光子集成核心技术，并建立起独具特色的光子集成芯片设计和制造平台、光子集成器件封装平台、高速光器件和光模块综合测试平台，具备从芯片材料-芯片设计-芯片流片-芯片封测-组件模块的研发制造整合能力。奇芯光电独创的材料平台，集合了Si和SiO2两大材料平台的优势，将光子集成规模大幅度提高了40倍；瞄准高速率、多功能、多通道、超高密度、微小尺寸和低功耗等高端市场痛点，有效降低了设备成本和运维成本，推动光通信产业的集成化、小型化和实用化。,"[[""Dong Cheng    创始人、董事长兼总经理\n中国科学院西安光学精密机械研究所信息光子器件与光子集成中心主任、研究员，陕西光电子集成先导技术研究院副院长，美国光学学会会员，中国光学学会纤维光学和集成光学专业委员会委员，陕西省“优秀外国专家”入选者。曾在芬兰Nokia和Optonex、加拿大Nortel Networks、OneChip等国际知名光通信企业担任高管和高级研发人员，具有长达25年的光通信行业研发及管理经验。"", ""创始人、董事长兼总经理\n中国科学院西安光学精密机械研究所信息光子器件与光子集成中心主任、研究员，陕西光电子集成先导技术研究院副院长，美国光学学会会员，中国光学学会纤维光学和集成光学专业委员会委员，陕西省“优秀外国专家”入选者。曾在芬兰Nokia和Optonex、加拿大Nortel Networks、OneChip等国际知名光通信企业担任高管和高级研发人员，具有长达25年的光通信行业研发及管理经验。"", ""中国科学院西安光学精密机械研究所信息光子器件与光子集成中心主任、研究员，陕西光电子集成先导技术研究院副院长，美国光学学会会员，中国光学学会纤维光学和集成光学专业委员会委员，陕西省“优秀外国专家”入选者。曾在芬兰Nokia和Optonex、加拿大Nortel Networks、OneChip等国际知名光通信企业担任高管和高级研发人员，具有长达25年的光通信行业研发及管理经验。""]]",[],作为国内光子集成领域的开拓者，西安奇芯光电科技有限公司，凝聚了国内外顶尖的光通信和光子集成领域的人才，凭借在光通信研发和制造领域多年的经验，掌握全球唯一兼具高折射率差、超低损耗、微小尺寸、多层回路的光子集成核心技术，并建立起独具特色的光子集成芯片设计和制造平台、光子集成器件封装平台、高速光器件和光模块综合测试平台，具备从芯片材料-芯片设计-芯片流片-芯片封测-组件模块的研发制造整合能力，在推动我国信息技术高端光子芯片和器件技术方面具有独特的战略地位。,西安奇芯光电科技有限公司,9161013109277730XN,Dong Cheng,2014-02-27,475万元,,互递名片后可见,互递名片后可见,深圳市合创资本管理有限公司,https://www.chinahtz.com/sizeScinspark/detail.do?id=182,https://www.chinahtz.com/fileUpload/2019-3/89e384d0-28a6-4381-93aa-0878f30808ee.pdf
19,37,数字视网膜人工智能芯片,"人工智能,半导体/芯片,视频/音频技术",初创期,5000万-1亿,"浙江,杭州",杭州博雅鸿图视频技术有限公司成立于2017年7月，专注提供以视觉智能计算为核心的大数据解决方案，提供人工智能芯片+算法+软件定义智能的解决方案平台，服务5G时代的物联网视觉融合计算，推动数字视网膜技术体系的生态和标准发展。数字视网膜是公司董事长高文院士首先提出的解决大规模人工智能应用的视频技术支撑体系，解决方案主要面向的领域有城市级海量视频大数据智能计算、物联网前端融合感知、军民融合等领域。核心经营团队来自北京大学数字视频编解码技术国家工程实验室产业化团队，团队的主要成果包括AVS国家标准和CDVS国际标准的设计和推广，拥有完整的IP设计能力和芯片研发经验。公司总部落户于杭州市，是杭州市、西湖区、云栖小镇重点扶持企业。目前在北京、杭州、南京、深圳有运营机构或研发中心，公司目前有员工100余人，其中80%为科研人员，包括芯片设计、嵌入式开发、系统设计、SoC集成等领域，团队拥有10年以上AVS编解码芯片开发经验以及专业的应用方案设计及技术支持经验。公司已获得银杏谷资本、合创资本等机构数千万元的投资。本轮融资主要用于扩充核心技术研发团队、芯片量产与迭代、市场推广与运营等。,"[[""贾惠柱    CEO\n博士，北京大学信息科学技术学院副研究员，浙江省北大信息技术高等研究院副院长，北京大学数字媒体研究所副所长，浙江省智慧视频产业技术联盟秘书长。 主持研制中国首款专业级AVS+高清视频编码SoC芯片，近年来主持/参与20余项国家项目，授权中国发明专利34项，合作编著1部，在相关领域发表学术论文60余篇，获得国家科学技术进步二等奖（2017）和中国电子学会电子信息科学技术一等奖（2010）。"", ""CEO\n博士，北京大学信息科学技术学院副研究员，浙江省北大信息技术高等研究院副院长，北京大学数字媒体研究所副所长，浙江省智慧视频产业技术联盟秘书长。 主持研制中国首款专业级AVS+高清视频编码SoC芯片，近年来主持/参与20余项国家项目，授权中国发明专利34项，合作编著1部，在相关领域发表学术论文60余篇，获得国家科学技术进步二等奖（2017）和中国电子学会电子信息科学技术一等奖（2010）。"", ""博士，北京大学信息科学技术学院副研究员，浙江省北大信息技术高等研究院副院长，北京大学数字媒体研究所副所长，浙江省智慧视频产业技术联盟秘书长。 主持研制中国首款专业级AVS+高清视频编码SoC芯片，近年来主持/参与20余项国家项目，授权中国发明专利34项，合作编著1部，在相关领域发表学术论文60余篇，获得国家科学技术进步二等奖（2017）和中国电子学会电子信息科学技术一等奖（2010）。""]]",[],"杭州博雅鸿图视频技术有限公司成立于2017年7月，专注提供以视觉智能计算为核心的大数据解决方案，提供人工智能芯片+算法+软件定义智能的解决方案平台，服务5G时代的物联网视觉融合计算，推动数字视网膜技术体系的生态和标准发展。
解决方案主要面向的领域有城市级海量视频大数据智能计算、物联网前端融合感知、军民融合等领域。
核心经营团队来自北京大学数字视频编解码技术国家工程实验室产业化团队，团队的主要成果包括AVS国家标准和CDVS国际标准的设计和推广，拥有完整的IP设计能力和芯片研发经验。
公司总部落户于杭州市，是杭州市，西湖区重点扶持企业。目前在北京、杭州、南京、深圳有运营机构或研发中心.",杭州博雅鸿图视频技术有限公司,91330106MA28UQPNXM,贾惠柱,2017-07-06,1375万元,,互递名片后可见,互递名片后可见,深圳市合创资本管理有限公司,https://www.chinahtz.com/sizeScinspark/detail.do?id=182,https://www.chinahtz.com/fileUpload/2019-3/72af7d00-e925-487b-b880-1376f83bc364.pdf
