8,15,阿尔法智联物联网芯片,"半导体/芯片,智能硬件",初创期,500-1000万,"北京,海淀区",阿尔法智联是在清华科技园成立的科技型企业，主要聚焦在LED驱动器芯片和物联网芯片的设计和开发，拥有国际最领先的LED驱动技术。产品主要应用于智慧照明、智慧环境、智慧零售、智慧物流、智慧城市、智慧工厂等领域，致力于通过智慧照明打造信息高速公路和智慧生态圈。,"[[""曹绪尧    联合创始人/CMO\n擅长市场营销，曾帮助100多家国内企业建立互联网营销体系，全程参与清华大学_麦肯锡数字化能力发展中心二期项目建设，主要负责DPM系统设计，数字化示范工厂硬件集成以及数字化营销，曾在两家初创企业担任高级战略顾问，帮助其中一家企业完成500万融资。"", ""联合创始人/CMO\n擅长市场营销，曾帮助100多家国内企业建立互联网营销体系，全程参与清华大学_麦肯锡数字化能力发展中心二期项目建设，主要负责DPM系统设计，数字化示范工厂硬件集成以及数字化营销，曾在两家初创企业担任高级战略顾问，帮助其中一家企业完成500万融资。"", ""擅长市场营销，曾帮助100多家国内企业建立互联网营销体系，全程参与清华大学_麦肯锡数字化能力发展中心二期项目建设，主要负责DPM系统设计，数字化示范工厂硬件集成以及数字化营销，曾在两家初创企业担任高级战略顾问，帮助其中一家企业完成500万融资。""]]",,公司核心团队来源于清华大学、多伦多大学、麦肯锡咨询公司、高盛公司、德国弗劳恩霍夫研究所等知名机构。目前已经与启迪之星、哈佛大学、清华大学、麻省理工大学、哈佛大学、飞利浦照明、美国Bambu、TCL照明、中船重工、德国弗劳恩霍夫研究所等建立了紧密的合作关系，项目已被列为山东省重大科技专项项目并落地投产，同时正在并购国内知名照明企业和德国知名照明企业。,阿尔法智联（北京）科技有限公司,91110108MA01G6J7XB,竺浩亮,2018-12-14,500万元,,互递名片后可见,互递名片后可见,启迪之星,https://www.chinahtz.com/sizeScinspark/detail.do?id=479,https://www.chinahtz.com/fileUpload/2019-5/71421996-1c8d-4249-bb69-d3d83ef9dc63.pdf
9,17,MEMS压电芯片及水声传感系统,"物联网,半导体/芯片,海洋工程",初创期,500-1000万,"广东,广州",公司现有核心产品是全球第一个基于半导体MEMS制造平台的水听器和基于AlN（氮化铝）的压电MEMS传感芯片，主要面向声呐探测、局放监测、管道测漏、航道监测、水下通讯、地质勘探、海洋渔业等方面的应用。,"[[""凌坚    董事总经理\n北京邮电大学硕士研究生毕业，获得北京市LG硕士奖学金，多篇核心期刊MEMS方向论文， 18项发明专利（已授权），2项实用新型（已授权） 。 十五年的从业经验，先后从事过技术研发和管理工作，担任过上市公司研发工程师、研发经理、总经理助理、副总经理等多个岗位。 目前负责公司全面工作。"", ""董事总经理\n北京邮电大学硕士研究生毕业，获得北京市LG硕士奖学金，多篇核心期刊MEMS方向论文， 18项发明专利（已授权），2项实用新型（已授权） 。 十五年的从业经验，先后从事过技术研发和管理工作，担任过上市公司研发工程师、研发经理、总经理助理、副总经理等多个岗位。 目前负责公司全面工作。"", ""北京邮电大学硕士研究生毕业，获得北京市LG硕士奖学金，多篇核心期刊MEMS方向论文， 18项发明专利（已授权），2项实用新型（已授权） 。 十五年的从业经验，先后从事过技术研发和管理工作，担任过上市公司研发工程师、研发经理、总经理助理、副总经理等多个岗位。 目前负责公司全面工作。""]]",,"广州辰方互联信息科技有限公司（简称“广州辰方”）以微机电（MEMS）技术为核心，致力于物探物联行业，为社会、客户创造更高价值。
公司现有核心产品是全球第一个基于半导体MEMS制造平台的水听器，主要面向声呐探测、局放监测、管道测漏、航道监测、水下通讯、地质勘探、海洋渔业等方面的应用。
MEMS 技术造就了微小尺寸的水听器，增加了可靠性、一致性、运输与安装的便利程度，同时也允许用户在有限空间部署尽可能多的水听器来组成阵列，提升水下无人船（AUV，ROV，UUV等）工作性能，对于某些受声波波长影响而要求小尺寸的应用影响深远……",广州辰方互联信息科技有限公司,91440101MA5AWUUB25,2018-06-01,500万元,"物联网,半导体/芯片,海洋工程",,互递名片后可见,baiyunjlu2006@qq.com,广州市金融局,https://www.chinahtz.com/sizeScinspark/detail.do?id=173,https://www.chinahtz.com/fileUpload/2019-5/2cd2b075-ff32-4a3f-96db-dd26b90953df.pdf
10,19,电子设计自动化（EDA）软件提供商,半导体/芯片,种子期,100-500万,"浙江,杭州",公司是一家电子设计自动化（EDA）软件提供商。致力于为国内外集成电路设计用户提供快速、准确、完整的电磁设计平台，着力解决芯片设计中日益复杂的高效大容量电磁仿真、建模和分析及优化设计等关键性问题，帮助用户提高产品设计开发效率，增强用户产品的竞争力和创新力，公司秉承“为设计最快的集成电路芯片提供保障”的企业使命服务全球用户。,"[[""王高峰    CEO\n1990-1993 美国威斯康辛大学，获电子工程博士学位；1997-2000 美国斯坦福大学，获科学计算博士学位；2004-2010 美国Siargo公司（创始人及首席技术官）；2010-2013 美国Lorentz Solution公司 （首席科学家）；2004-2013 武汉大学微电子与信息技术研究院（兼职院长、教授、博导）；2013至今杭州电子科技大学电子信息学院（二级教授、博导）。"", ""CEO\n1990-1993 美国威斯康辛大学，获电子工程博士学位；1997-2000 美国斯坦福大学，获科学计算博士学位；2004-2010 美国Siargo公司（创始人及首席技术官）；2010-2013 美国Lorentz Solution公司 （首席科学家）；2004-2013 武汉大学微电子与信息技术研究院（兼职院长、教授、博导）；2013至今杭州电子科技大学电子信息学院（二级教授、博导）。"", ""1990-1993 美国威斯康辛大学，获电子工程博士学位；1997-2000 美国斯坦福大学，获科学计算博士学位；2004-2010 美国Siargo公司（创始人及首席技术官）；2010-2013 美国Lorentz Solution公司 （首席科学家）；2004-2013 武汉大学微电子与信息技术研究院（兼职院长、教授、博导）；2013至今杭州电子科技大学电子信息学院（二级教授、博导）。""]]",,公司成立于2017年，致力于后摩尔时代射频和超高速集成电路EDA软件及IP开发，着力解决芯片设计中复杂的大容量电磁建模、仿真分析及优化设计问题提高产业集成电路的高频高速设计水平。,杭州泛利科技有限公司,91330100MA28MK7A97,2017-03-09,1000万元,半导体/芯片,,互递名片后可见,互递名片后可见,浙江股权交易中心,https://www.chinahtz.com/sizeScinspark/detail.do?id=276,https://www.chinahtz.com/fileUpload/2019-5/3cc87e7a-7030-422a-9cb1-eb781e2b587d.pdf
11,21,功率半导体,半导体/芯片,成长期,5000万-1亿,"广东,广州",公司由一批长期致力于中国功率半导体国产化的技术团队、市场营销团队、管理团队和投资人共同组建。公司技术团队平均年龄超过三十五岁，主要核心人员均在国际一流半导体公司有超过十年的经验。目前公司有十五名员工，60%为研发人员。博士两名，硕士四名，其他都是本科以上学位。到年底人员规模会扩展到三十名，70%为研发人员。,"[[""黄昕    CEO\n复旦大学博士，二十年跨国半导体公司功率半导体技术与产品开发管理经验，开发出国际领先的75V-6500V功率分立器件技术 拥有沟槽功率MOSFET，超结功率MOSFET，IGBT/FRD及RFLDMOS以及BCD等技术和产品业界领先的开发能力，申请国内专利超过80项，美国专利1项。"", ""CEO\n复旦大学博士，二十年跨国半导体公司功率半导体技术与产品开发管理经验，开发出国际领先的75V-6500V功率分立器件技术 拥有沟槽功率MOSFET，超结功率MOSFET，IGBT/FRD及RFLDMOS以及BCD等技术和产品业界领先的开发能力，申请国内专利超过80项，美国专利1项。"", ""复旦大学博士，二十年跨国半导体公司功率半导体技术与产品开发管理经验，开发出国际领先的75V-6500V功率分立器件技术 拥有沟槽功率MOSFET，超结功率MOSFET，IGBT/FRD及RFLDMOS以及BCD等技术和产品业界领先的开发能力，申请国内专利超过80项，美国专利1项。""]]",,公司成立于2017年，公司经营理念为不与国内其他厂商直接竞争，定位高端产品，替换国际主流公司产品，实现高端产品国产化使命。主要客户为国内一流的电源和能源厂商，上市公司。旨在将公司打造为国内领先，国际一流的功率半导体公司，为电能的高效使用做出贡献是团队的使命。,广州安海半导体股份有限公司,91440101MA59U7269W,2017-09-18,2500万元,半导体/芯片,,互递名片后可见,互递名片后可见,浙江股权交易中心,https://www.chinahtz.com/sizeScinspark/detail.do?id=276,https://www.chinahtz.com/fileUpload/2019-5/95d44ff5-5931-438f-ba7f-d3179c193295.pdf
12,23,无机纳米涂层银键合丝,"新材料,半导体/芯片,金属冶炼及制品",初创期,1000-3000万,"广东,佛山","项目产品采用无机纳米涂层包裹银键合丝表面，致密的纳米保护层使银键合丝达到防硫化的效果，同时提高其表面亮度10%。键合丝是半导体器件电信号传递的关键材料，银极易硫化，造成器件失效，本项目防硫化产品――无机纳米涂层银键合丝主要应用于高端SSD、DRAM以及LED领域，项目产品目前处于小试阶段。
公司有以下优势：
创新优势：公司与广东工业大学电子精密制造技术及装备省部共建国家重点实验室材料研发团队深度合作开展键合丝相关研发工作，拥有资深的研发团队。
运营优势：公司运营团队全部来自于深圳禾木科技有限公司，团队成员都在行业内拥有十余年的相关经验，企业运营有保障。
市场优势：团队在行业内已深耕十余年，客户资源稳定。
资源优势：国家“千人计划”专家崔成强教授、林挺宇博士，日月光副总裁郭一凡先生都是行业顶尖人才，能给企业带来得天独厚的资源。
本次融资资金主要用于产线设备的购置与股权赎回。","[[""崔成强    研发总负责人\n国家“千人计划专家”，曾任新加坡微电子研究所研究员，香港金柏科技首席技术官，北方兵器首席科学家，曾主持02专项、863计划等，新加坡非传统键合丝生产商胜纬科技（Sem wire）合伙人"", ""研发总负责人\n国家“千人计划专家”，曾任新加坡微电子研究所研究员，香港金柏科技首席技术官，北方兵器首席科学家，曾主持02专项、863计划等，新加坡非传统键合丝生产商胜纬科技（Sem wire）合伙人"", ""国家“千人计划专家”，曾任新加坡微电子研究所研究员，香港金柏科技首席技术官，北方兵器首席科学家，曾主持02专项、863计划等，新加坡非传统键合丝生产商胜纬科技（Sem wire）合伙人""]]",[],"广东禾木科技是一家专注传统键合丝制造与非传统键合丝升级研发的新兴科技企业，公司成立于2016年12月，公司坐落于佛山国家高新技术产业开发区。目前公司新型研发产品采用无机纳米涂层对传统银键合丝表面进行处理，其优异的性能与技术皆属行业首创。
广东禾木科技与广东工业大学电子精密制造技术及装备省部共建国家重点实验室深度合作开展键合丝相关研发工作，目前拥有多项相关专利和自主知识产权。 现有研发带头人包括：“国家千人计划专家”2人，教授/博士生导师2人，博士3人。
一直以来，禾木科技坚守“以质量与服务打造行业标杆”的原则，专注于技术创新与生产管控，以提升产品及服务质量为基本工作，持续产品创新升级。",广东禾木科技有限公司,91440605MA4W28X498,符再安,2016-12-09,1000万元,,互递名片后可见,互递名片后可见,广东股权交易中心广东金融高新区分公司,https://www.chinahtz.com/sizeScinspark/detail.do?id=135,https://www.chinahtz.com/fileUpload/2019-3/e4622ced-9728-4b02-97ff-e50e2aa31856.pdf
13,25,智能网络通信指挥系统,"军工技术,半导体/芯片,电子信息/电子设备",初创期,1000-3000万,"北京,海淀区",公司依靠自身技术优势和整合的系统资源，先后进军智能城市运营管理体系、广播电视传输、电视播出和直播、互联网和通信网络、城市智能监控、卫星通信、专网电视会议等领域的技术解决方案和系统集成项目。,"[[""魏真正    总经理\n2000年7月－今北京正荣网际科技股份有限公司总经理，有30年光纤通信、光纤有线电视网络、光纤图像传输与控制系统、计算机网络、话音通信网络等城市化系统集成、系统化建设、交钥匙的专业经验。全国第一个智慧城市图像和信息联网设计和建设人，全国第一个大型城市交通图像监控实施落地人，国家委、办、局智慧城市图像联网领导专家组专家，公安部公共安防运维标准专家组专家。"", ""总经理\n2000年7月－今北京正荣网际科技股份有限公司总经理，有30年光纤通信、光纤有线电视网络、光纤图像传输与控制系统、计算机网络、话音通信网络等城市化系统集成、系统化建设、交钥匙的专业经验。全国第一个智慧城市图像和信息联网设计和建设人，全国第一个大型城市交通图像监控实施落地人，国家委、办、局智慧城市图像联网领导专家组专家，公安部公共安防运维标准专家组专家。"", ""2000年7月－今北京正荣网际科技股份有限公司总经理，有30年光纤通信、光纤有线电视网络、光纤图像传输与控制系统、计算机网络、话音通信网络等城市化系统集成、系统化建设、交钥匙的专业经验。全国第一个智慧城市图像和信息联网设计和建设人，全国第一个大型城市交通图像监控实施落地人，国家委、办、局智慧城市图像联网领导专家组专家，公安部公共安防运维标准专家组专家。""]]",[],公司致力于智能化的数字高清图像传输和显示技术、智能城市联网系统数据深度挖掘、多媒体图像传输技术、信息数据化技术、高清图像处理技术、与人工智能、物联网、绿色经济等相关联新媒体技术的重新定义的创新、开发、整合。,北京正荣网际科技股份有限公司,91110108723951723M,2000-06-26,1000万元,"军工技术,半导体/芯片,电子信息/电子设备",,互递名片后可见,互递名片后可见,中国北京（海淀）留学人员创业园,https://www.chinahtz.com/sizeScinspark/detail.do?id=347,https://www.chinahtz.com/fileUpload/2019-3/13f42199-4448-4c69-9570-f5bedc25cbec.pdf
14,27,硬之城,"电子商务,半导体/芯片",成长期,3000-5000万,"广东,深圳","项目是智能化元器件供应链服务平台，平台结合大数据与人工智能技术，为硬件制造企业提供一站式元器件供应服务，帮助企业节约人力、时间及物料成本。2016年3月，硬之城（Allchips.com）上线；2016年6月，获天使轮投资（睿鼎资本）；2017年6月，获Pre-A轮投资（蓝海众力资本）；2017年8月，获得“国家高新技术企业”认证；2017年12月，获A轮投资（朗科投资领投）；2018年7月，荣获中国B2B百强第85名。

项目核心团队由来至腾讯、华为、富士康及上市公司高管组成，产业+互联网完整组合，2019年预计营收5亿，目标2022年营收100亿。本轮融资资金主要用于：大数据与人工智能技术投入、业务规模化扩张、仓储物流等供应链建设、市场运营、品牌推广及产业链投资布局。","[[""李六七    总经理\n男，1980年9月出生，中国国籍，汉族，政治面貌为群众，无境外永久居留权，毕业于西北大学，研究生学历，工商管理专业。2004年7月至2005年7月，任深圳市福奈特科技有限公司外贸业务员；2005年8月至2007年1月，任深圳市环球纵横科技有限公司副总经理；2007年2月至2015年7月，任华盛股份有限公司总经理；2015年8月至今，任深圳前海硬之城信息技术有限公司执行董事兼总经理。"", ""总经理\n男，1980年9月出生，中国国籍，汉族，政治面貌为群众，无境外永久居留权，毕业于西北大学，研究生学历，工商管理专业。2004年7月至2005年7月，任深圳市福奈特科技有限公司外贸业务员；2005年8月至2007年1月，任深圳市环球纵横科技有限公司副总经理；2007年2月至2015年7月，任华盛股份有限公司总经理；2015年8月至今，任深圳前海硬之城信息技术有限公司执行董事兼总经理。"", ""男，1980年9月出生，中国国籍，汉族，政治面貌为群众，无境外永久居留权，毕业于西北大学，研究生学历，工商管理专业。2004年7月至2005年7月，任深圳市福奈特科技有限公司外贸业务员；2005年8月至2007年1月，任深圳市环球纵横科技有限公司副总经理；2007年2月至2015年7月，任华盛股份有限公司总经理；2015年8月至今，任深圳前海硬之城信息技术有限公司执行董事兼总经理。""]]",[],公司简称硬之城，是国内元器件网络直购商城。硬之城于2016年3月上线。公司核心团队由来至腾讯、华为、富士康及上市公司高管组成，产业+互联网完整组合，2019年公司预计营收5亿，目标2022年营收100亿。,深圳前海硬之城信息技术有限公司,91440300349751763P,2015-08-07,550万元,"电子商务,半导体/芯片",,互递名片后可见,互递名片后可见,中航爱创客,https://www.chinahtz.com/sizeScinspark/detail.do?id=515,https://www.chinahtz.com/fileUpload/2019-2/82a53ce9-c881-4d8e-a4a3-691ba04b85de.pdf
15,29,基于原子层沉积的半导体材料及应用,"新材料,半导体/芯片",初创期,1000-3000万,"安徽,合肥","项目以拥有自主知识产权的原子层沉积（ALD）技术为核心，利用团队在ALD前驱体材料开发生产、ALD应用整合工艺等方面具有多年国际顶级行业经验和雄厚竞争力，研发和生产应用于各类先进制程芯片的功能薄膜沉积材料，并同时提供应用工艺解决方案。
本团队是目前国内唯一一家，也是世界上少数可以提供前驱体材料研发、流程工艺整合以及设备开发技术的公司，在半导体集成电路领域打破国外垄断，填补国内空白。除此之外，我们的解决方案应用场景广泛，能够为新能源，高清显示（OLED），光电器件等多个领域提供高性能纳米级功能薄膜制造的解决方案。技术壁垒高，附加值大，市场前景广阔。
创始团队均在国内外知名高校获得博士/硕士等高等学位，并有多年海外行业垄断企业从事管理研发的丰富经验，拥有代表世界最先进水平的技术积累。
公司于2018年夏成立，已完成千万级别天使轮融资。目前已在合肥建立研发基地，用于材料开发、工艺验证及小试线产品放大。本轮融资将用于前端研发能力和研发工程团队的持续拓展，以及中试线工艺放大的探索研究。","[[""汪穹宇    CEO\n中国科技大学学士，美国德州大学奥斯丁分校硕士；在美国学习工作10余年； 曾在美国A123 Systems公司任职，负责美国能源部ARPA-E项目以及美国国防部DARPA材料技术研发。 后于美国苹果公司任职，先后担任产品工程师，技术研发部门经理。负责多代苹果手机和平板产品的电池开发与量产，领导了跨领域团队成功开发苹果过去三代的电池技术平台，并主导多个未来技术项目的开发和验证。"", ""CEO\n中国科技大学学士，美国德州大学奥斯丁分校硕士；在美国学习工作10余年； 曾在美国A123 Systems公司任职，负责美国能源部ARPA-E项目以及美国国防部DARPA材料技术研发。 后于美国苹果公司任职，先后担任产品工程师，技术研发部门经理。负责多代苹果手机和平板产品的电池开发与量产，领导了跨领域团队成功开发苹果过去三代的电池技术平台，并主导多个未来技术项目的开发和验证。"", ""中国科技大学学士，美国德州大学奥斯丁分校硕士；在美国学习工作10余年； 曾在美国A123 Systems公司任职，负责美国能源部ARPA-E项目以及美国国防部DARPA材料技术研发。 后于美国苹果公司任职，先后担任产品工程师，技术研发部门经理。负责多代苹果手机和平板产品的电池开发与量产，领导了跨领域团队成功开发苹果过去三代的电池技术平台，并主导多个未来技术项目的开发和验证。""]]",[],安德科铭是一个以海归博士硕士为核心的初创公司，创始成员来自中科大，美国西北大学，美国德州大学等世界知名高等学府，并曾在美国苹果公司，美国应用材料公司，德国赢创化工等行业领军企业担任高级研发、管理职位。项目以拥有自主知识产权的原子层沉积（ALD）技术为核心，利用团队在ALD前驱体材料开发生产、ALD应用整合工艺等方面多年国际最先进经验积累，打造国内第一支有能力研发和生产应用于各类先进制程芯片的功能薄膜沉积材料，并同时提供应用工艺解决方案的团队，填补国内空白。同时我们的高性能纳米级功能薄膜解决方案还能够广泛涉及新能源，高清显示（OLED），光电器件等多个领域。,合肥安德科铭半导体科技有限公司,91340103MA2RQWYY92,汪穹宇,2018-05-29,500万元,,互递名片后可见,互递名片后可见,合肥高新技术产业开发区,https://www.chinahtz.com/sizeScinspark/detail.do?id=151,https://www.chinahtz.com/fileUpload/2019-4/cfb051da-f141-42c7-850b-911288b1f731.pdf
16,31,中高压大电流芯片,半导体/芯片,初创期,500-1000万,"广东,深圳",深度的系统和应用知识、强大的电源管理芯片创新设计、以及受专利保护的定制工艺是宝砾的核心竞争力。公司拥有完整的设计中高压大电流芯片的能力，自主研发了高性能低成本的领先工艺技术，并有世界级电源管理核心技术及市场开发能力。产品广泛应用在机顶盒、路由器、电视机、电子烟、 电表、 车载充电、电动交通工具、排插、高性能Type-C 充电器等领域。,"[[""邓海飞    CEO\n无"", ""CEO\n无"", ""无""]]",[],Powlicon Inc.（宝砾微电子有限公司）2013年创立于美国达拉斯，创始人均来自于美国著名半导体公司，有多年的电子行业研发、运营及管理经验。公司专注于为用户提供创新性的、高效能、高性价比、高集成度的电源管理IC。团队在充电管理以及相关市场有多年的累积及耕耘，给用户提供了领先于市场的解决方案，并且与国内外领先的代工厂和封装厂商都有良好的合作关系。,深圳宝砾微电子有限公司,91440300319316445F,2014-10-15,668万元,半导体/芯片,,互递名片后可见,互递名片后可见,深圳市科技服务业协会,https://www.chinahtz.com/sizeScinspark/detail.do?id=302,https://www.chinahtz.com/fileUpload/2018-11/e53e7d2a-2877-4d7a-86b3-d6d49baf31be.pdf
